,id,date,time,zone,currency,importance,event,actual,forecast,previous
2469,497832,26/04/2024,19:30,united states,USD,medium,CFTC S&P 500 speculative net positions,67.7K,,74.1K
2470,497829,26/04/2024,19:30,australia,AUD,medium,CFTC AUD speculative net positions,-96.2K,,-101.1K
2471,497835,26/04/2024,19:30,brazil,BRL,medium,CFTC BRL speculative net positions,1.0K,,0.9K
2472,497828,26/04/2024,19:30,japan,JPY,medium,CFTC JPY speculative net positions,-179.9K,,-165.6K
2473,497839,26/04/2024,19:30,euro zone,EUR,medium,CFTC EUR speculative net positions,-10.0K,,12.2K
2474,498780,26/04/2024,20:30,russia,RUB,medium,CFTC RUB speculative positions,,,-41.8K
2475,498345,27/04/2024,16:00,russia,RUB,medium,GDP Monthly (YoY)  (Mar),4.2%,,7.6%
2476,498342,27/04/2024,16:00,russia,RUB,medium,Retail Sales (YoY)  (Mar),11.1%,7.6%,12.3%
2477,498343,27/04/2024,16:00,russia,RUB,medium,Unemployment Rate  (Mar),2.7%,2.9%,2.8%
2478,496910,29/04/2024,06:00,sweden,SEK,medium,GDP (YoY)  (Q1),-1.1%,-0.2%,-0.2%
2479,496908,29/04/2024,06:00,sweden,SEK,medium,GDP (QoQ)  (Q1),-0.1%,-0.1%,-0.1%
2480,496914,29/04/2024,07:00,spain,EUR,medium,Spanish CPI (YoY)  (Apr),3.3%,3.4%,3.2%
2481,496915,29/04/2024,07:00,spain,EUR,medium,Spanish HICP (YoY)  (Apr),3.4%,3.4%,3.3%
2482,498021,29/04/2024,09:30,italy,EUR,medium,Italian 10-Year BTP Auction,3.86%,,3.67%
2483,496955,29/04/2024,12:00,germany,EUR,medium,German CPI (YoY)  (Apr),2.2%,2.3%,2.2%
2484,496956,29/04/2024,12:00,germany,EUR,high,German CPI (MoM)  (Apr),0.5%,0.6%,0.4%
2485,496979,29/04/2024,23:50,japan,JPY,medium,Industrial Production (MoM)  (Mar),3.8%,3.4%,-0.6%
2486,496987,30/04/2024,01:30,australia,AUD,medium,Retail Sales (MoM)  (Mar),-0.4%,0.2%,0.2%
2487,496986,30/04/2024,01:30,china,CNY,medium,Chinese Composite PMI  (Apr),51.7,,52.7
2488,496984,30/04/2024,01:30,china,CNY,high,Manufacturing PMI  (Apr),50.4,50.3,50.8
2489,496983,30/04/2024,01:30,china,CNY,medium,Non-Manufacturing PMI  (Apr),51.2,52.3,53.0
2490,496988,30/04/2024,01:45,china,CNY,medium,Caixin Manufacturing PMI  (Apr),51.4,51.0,51.1
2491,496996,30/04/2024,05:30,france,EUR,medium,French Consumer Spending (MoM)  (Mar),0.4%,0.2%,0.1%
2492,496994,30/04/2024,05:30,france,EUR,medium,French GDP (YoY)  (Q1),1.1%,0.9%,0.8%
2493,496995,30/04/2024,05:30,france,EUR,medium,French GDP (QoQ)  (Q1),0.2%,0.1%,0.1%
2494,496999,30/04/2024,06:00,germany,EUR,medium,German Retail Sales (MoM)  (Mar),1.8%,1.3%,-1.9%
2495,497005,30/04/2024,06:30,hungary,HUF,medium,GDP (YoY)  (Q1),1.1%,1.0%,0.0%
2496,497007,30/04/2024,06:45,france,EUR,medium,French CPI (MoM)  (Apr),0.5%,0.5%,0.2%
2497,497981,30/04/2024,06:45,france,EUR,medium,French HICP (MoM),0.6%,0.5%,0.2%
2498,497018,30/04/2024,07:00,switzerland,CHF,medium,KOF Leading Indicators  (Apr),101.8,102.1,100.4
2499,497020,30/04/2024,07:00,spain,EUR,medium,Spanish GDP (QoQ)  (Q1),0.7%,0.4%,0.7%
2500,497032,30/04/2024,07:55,germany,EUR,medium,German Unemployment Change  (Apr),10K,7K,6K
2501,497029,30/04/2024,07:55,germany,EUR,medium,German Unemployment Rate  (Apr),5.9%,5.9%,5.9%
2502,497037,30/04/2024,08:00,germany,EUR,high,German GDP (QoQ)  (Q1),0.2%,0.1%,-0.5%
2503,497035,30/04/2024,08:00,germany,EUR,medium,German GDP (YoY)  (Q1),-0.2%,-0.2%,-0.2%
2504,498039,30/04/2024,09:00,euro zone,EUR,medium,Core CPI (YoY)  (Apr),2.7%,2.6%,2.9%
2505,498040,30/04/2024,09:00,euro zone,EUR,medium,CPI (MoM)  (Apr),0.6%,,0.8%
2506,497055,30/04/2024,09:00,euro zone,EUR,high,CPI (YoY)  (Apr),2.4%,2.4%,2.4%
2507,497052,30/04/2024,09:00,euro zone,EUR,medium,GDP (QoQ)  (Q1),0.3%,0.1%,-0.1%
2508,497054,30/04/2024,09:00,euro zone,EUR,medium,GDP (YoY)  (Q1),0.4%,0.2%,0.1%
2509,497073,30/04/2024,12:00,mexico,MXN,medium,GDP (YoY)  (Q1),1.6%,,2.5%
2510,497071,30/04/2024,12:00,mexico,MXN,medium,GDP (QoQ)  (Q1),0.2%,,0.1%
2511,498044,30/04/2024,12:00,brazil,BRL,medium,Unemployment Rate,7.9%,,7.8%
2512,497081,30/04/2024,12:30,united states,USD,medium,Employment Cost Index (QoQ)  (Q1),1.2%,1.0%,0.9%
2513,497082,30/04/2024,12:30,canada,CAD,medium,GDP (MoM)  (Feb),0.2%,0.3%,0.5%
2514,497987,30/04/2024,12:31,canada,CAD,medium,GDP (MoM)  (Mar),0.0%,,0.2%
2515,497085,30/04/2024,13:00,united states,USD,medium,S&P/CS HPI Composite - 20 n.s.a. (MoM)  (Feb),0.9%,,-0.1%
2516,497087,30/04/2024,13:00,united states,USD,medium,S&P/CS HPI Composite - 20 n.s.a. (YoY)  (Feb),7.3%,6.7%,6.6%
2517,497093,30/04/2024,13:45,united states,USD,high,Chicago PMI  (Apr),37.9,44.9,41.4
2518,497094,30/04/2024,14:00,united states,USD,high,CB Consumer Confidence  (Apr),97.0,104.0,103.1
2519,498051,30/04/2024,20:30,united states,USD,medium,API Weekly Crude Oil Stock,4.906M,-1.500M,-3.230M
2520,498225,01/05/2024,06:00,united kingdom,GBP,medium,Nationwide HPI (YoY)  (Apr),0.6%,1.2%,1.6%
2521,498224,01/05/2024,06:00,united kingdom,GBP,medium,Nationwide HPI (MoM)  (Apr),-0.4%,0.2%,-0.2%
2522,497164,01/05/2024,08:30,united kingdom,GBP,medium,S&P Global/CIPS UK Manufacturing PMI  (Apr),49.1,48.7,50.3
2523,497180,01/05/2024,12:15,united states,USD,high,ADP Nonfarm Employment Change  (Apr),192K,179K,208K
2524,497182,01/05/2024,13:45,united states,USD,high,S&P Global US Manufacturing PMI  (Apr),50.0,49.9,51.9
2525,497188,01/05/2024,14:00,united states,USD,medium,Construction Spending (MoM)  (Mar),-0.2%,0.3%,-0.3%
2526,497185,01/05/2024,14:00,united states,USD,medium,ISM Manufacturing Employment  (Apr),48.6,48.2,47.4
2527,497186,01/05/2024,14:00,united states,USD,high,ISM Manufacturing PMI  (Apr),49.2,50.0,50.3
2528,497184,01/05/2024,14:00,united states,USD,high,ISM Manufacturing Prices  (Apr),60.9,55.5,55.8
2529,497183,01/05/2024,14:00,united states,USD,high,JOLTS Job Openings  (Mar),8.488M,8.680M,8.813M
2530,498251,01/05/2024,14:30,united states,USD,high,Crude Oil Inventories,7.265M,-2.300M,-6.368M
2531,498247,01/05/2024,14:30,united states,USD,medium,Cushing Crude Oil Inventories,1.089M,,-0.659M
2532,499003,01/05/2024,17:00,united states,USD,medium,Atlanta Fed GDPNow  (Q2),3.3%,3.9%,3.9%
2533,472445,01/05/2024,18:00,united states,USD,high,Fed Interest Rate Decision,5.50%,5.50%,5.50%
2534,497198,02/05/2024,01:30,australia,AUD,medium,Building Approvals (MoM)  (Mar),1.9%,3.5%,-0.9%
2535,498062,02/05/2024,01:30,australia,AUD,medium,Trade Balance,5.024B,7.190B,6.591B
2536,497226,02/05/2024,06:30,switzerland,CHF,medium,CPI (MoM)  (Apr),0.3%,0.1%,0.0%
2537,497232,02/05/2024,07:15,spain,EUR,medium,HCOB Spain Manufacturing PMI  (Apr),52.2,51.3,51.4
2538,497233,02/05/2024,07:30,switzerland,CHF,medium,procure.ch PMI  (Apr),41.4,45.5,45.2
2539,497236,02/05/2024,07:45,italy,EUR,medium,HCOB Italy Manufacturing PMI  (Apr),47.3,50.3,50.4
2540,497237,02/05/2024,07:50,france,EUR,medium,HCOB France Manufacturing PMI  (Apr),45.3,44.9,46.2
2541,497238,02/05/2024,07:55,germany,EUR,medium,HCOB Germany Manufacturing PMI  (Apr),42.5,42.2,41.9
2542,497240,02/05/2024,08:00,euro zone,EUR,medium,HCOB Eurozone Manufacturing PMI  (Apr),45.7,45.6,46.1
2543,497902,02/05/2024,12:30,united states,USD,medium,Continuing Jobless Claims,"1,774K","1,800K","1,774K"
2544,498073,02/05/2024,12:30,united states,USD,medium,Exports,257.60B,,263.00B
2545,498072,02/05/2024,12:30,united states,USD,medium,Imports,327.00B,,331.90B
2546,497901,02/05/2024,12:30,united states,USD,high,Initial Jobless Claims,208K,212K,208K
2547,497257,02/05/2024,12:30,united states,USD,medium,Nonfarm Productivity (QoQ)  (Q1),0.3%,0.8%,3.5%
2548,497261,02/05/2024,12:30,united states,USD,medium,Trade Balance  (Mar),-69.40B,-69.50B,-69.50B
2549,497258,02/05/2024,12:30,united states,USD,medium,Unit Labor Costs (QoQ)  (Q1),4.7%,3.6%,0.4%
2550,497260,02/05/2024,12:30,canada,CAD,medium,Trade Balance  (Mar),-2.28B,1.10B,0.48B
2551,497270,02/05/2024,14:00,united states,USD,medium,Factory Orders (MoM)  (Mar),1.6%,1.6%,1.2%
2552,499004,02/05/2024,17:00,united states,USD,medium,Atlanta Fed GDPNow  (Q2),3.3%,3.3%,3.3%
2553,498281,02/05/2024,20:30,united states,USD,medium,Fed's Balance Sheet,"7,362B",,"7,402B"
2554,498084,03/05/2024,01:30,australia,AUD,medium,Home Loans (MoM),2.8%,1.0%,1.5%
2555,497322,03/05/2024,07:00,türkiye,TRY,medium,CPI (MoM)  (Apr),3.18%,3.40%,3.16%
2556,497325,03/05/2024,07:00,türkiye,TRY,medium,CPI (YoY)  (Apr),69.80%,70.33%,68.50%
2557,497333,03/05/2024,08:00,brazil,BRL,medium,IPC-Fipe Inflation Index (MoM)  (Apr),0.33%,,0.26%
2558,490136,03/05/2024,08:00,norway,NOK,medium,Interest Rate Decision,4.50%,,4.50%
2559,497334,03/05/2024,08:30,united kingdom,GBP,medium,S&P Global/CIPS UK Composite PMI  (Apr),54.1,54.0,52.8
2560,497336,03/05/2024,08:30,united kingdom,GBP,medium,S&P Global/CIPS UK Services PMI  (Apr),55.0,54.9,53.1
2561,497338,03/05/2024,09:00,euro zone,EUR,medium,Unemployment Rate  (Mar),6.5%,6.5%,6.5%
2562,497344,03/05/2024,12:00,brazil,BRL,medium,Industrial Production (YoY)  (Mar),-2.8%,-2.6%,5.4%
2563,497355,03/05/2024,12:30,united states,USD,high,Average Hourly Earnings (MoM)  (Apr),0.2%,0.3%,0.3%
2564,497353,03/05/2024,12:30,united states,USD,medium,Average Hourly Earnings (YoY) (YoY)  (Apr),3.9%,4.0%,4.1%
2565,497351,03/05/2024,12:30,united states,USD,high,Nonfarm Payrolls  (Apr),175K,238K,315K
2566,497354,03/05/2024,12:30,united states,USD,medium,Participation Rate  (Apr),62.7%,,62.7%
2567,497350,03/05/2024,12:30,united states,USD,medium,Private Nonfarm Payrolls  (Apr),167K,181K,243K
2568,497356,03/05/2024,12:30,united states,USD,medium,U6 Unemployment Rate  (Apr),7.4%,,7.3%
2569,497352,03/05/2024,12:30,united states,USD,high,Unemployment Rate  (Apr),3.9%,3.8%,3.8%
2570,497358,03/05/2024,13:45,united states,USD,medium,S&P Global Composite PMI  (Apr),51.3,50.9,52.1
2571,497359,03/05/2024,13:45,united states,USD,high,S&P Global Services PMI  (Apr),51.3,50.9,51.7
2572,497361,03/05/2024,14:00,united states,USD,medium,ISM Non-Manufacturing Employment  (Apr),45.9,49.0,48.5
2573,497360,03/05/2024,14:00,united states,USD,high,ISM Non-Manufacturing PMI  (Apr),49.4,52.0,51.4
2574,497362,03/05/2024,14:00,united states,USD,high,ISM Non-Manufacturing Prices  (Apr),59.2,55.0,53.4
2575,497906,03/05/2024,17:00,united states,USD,medium,U.S. Baker Hughes Oil Rig Count,499,,506
2576,497907,03/05/2024,17:00,united states,USD,medium,U.S. Baker Hughes Total Rig Count,605,,613
2577,498324,03/05/2024,19:30,united kingdom,GBP,medium,CFTC GBP speculative net positions,-29.0K,,-26.2K
2578,498332,03/05/2024,19:30,united states,USD,medium,CFTC Crude Oil speculative net positions,265.5K,,264.8K
2579,498330,03/05/2024,19:30,united states,USD,medium,CFTC Gold speculative net positions,204.2K,,202.9K
2580,498322,03/05/2024,19:30,united states,USD,medium,CFTC Nasdaq 100 speculative net positions,2.8K,,6.1K
2581,498320,03/05/2024,19:30,united states,USD,medium,CFTC S&P 500 speculative net positions,43.1K,,67.7K
2582,498317,03/05/2024,19:30,australia,AUD,medium,CFTC AUD speculative net positions,-83.2K,,-96.2K
2583,498323,03/05/2024,19:30,brazil,BRL,medium,CFTC BRL speculative net positions,0.3K,,1.0K
2584,498316,03/05/2024,19:30,japan,JPY,medium,CFTC JPY speculative net positions,-168.4K,,-179.9K
2585,498327,03/05/2024,19:30,euro zone,EUR,medium,CFTC EUR speculative net positions,-6.8K,,-10.0K
2586,499250,03/05/2024,20:30,russia,RUB,medium,CFTC RUB speculative positions,,,-41.8K
2587,497414,06/05/2024,01:45,china,CNY,medium,Caixin Services PMI  (Apr),52.5,52.5,52.7
2588,497430,06/05/2024,06:00,russia,RUB,medium,Russian S&P Global Services PMI  (Apr),50.5,,51.4
2589,498086,06/05/2024,07:00,spain,EUR,medium,Spanish Unemployment Change,-60.5K,-74.5K,-33.4K
2590,497433,06/05/2024,07:15,spain,EUR,medium,HCOB Spain Services PMI  (Apr),56.2,56.0,56.1
2591,497437,06/05/2024,07:45,italy,EUR,medium,HCOB Italy Services PMI  (Apr),54.3,54.7,54.6
2592,497440,06/05/2024,07:50,france,EUR,medium,HCOB France Services PMI  (Apr),51.3,50.5,48.3
2593,497992,06/05/2024,07:55,germany,EUR,medium,HCOB Germany Services PMI  (Apr),53.2,53.3,50.1
2594,497441,06/05/2024,08:00,euro zone,EUR,medium,HCOB Eurozone Composite PMI  (Apr),51.7,51.4,50.3
2595,497442,06/05/2024,08:00,euro zone,EUR,medium,HCOB Eurozone Services PMI  (Apr),53.3,52.9,51.5
2596,497893,06/05/2024,11:30,brazil,BRL,medium,Gross Debt-to-GDP ratio (MoM)  (Mar),75.7%,,75.5%
2597,497462,06/05/2024,23:01,united kingdom,GBP,medium,BRC Retail Sales Monitor (YoY)  (Apr),-4.4%,1.6%,3.2%
2598,497463,07/05/2024,00:30,japan,JPY,medium,au Jibun Bank Japan Services PMI  (Apr),54.3,54.6,54.1
2599,498473,07/05/2024,01:30,australia,AUD,medium,Retail Sales (MoM),-0.4%,-0.2%,0.2%
2600,490113,07/05/2024,04:30,australia,AUD,high,RBA Interest Rate Decision  (May),4.35%,4.35%,4.35%
2601,497483,07/05/2024,06:00,united kingdom,GBP,medium,Halifax House Price Index (MoM)  (Apr),0.1%,0.2%,-0.9%
2602,497485,07/05/2024,06:00,united kingdom,GBP,medium,Halifax House Price Index (YoY)  (Apr),1.1%,,0.4%
2603,497487,07/05/2024,06:00,germany,EUR,medium,German Factory Orders (MoM)  (Mar),-0.4%,0.4%,-0.8%
2604,497486,07/05/2024,06:00,germany,EUR,medium,German Trade Balance  (Mar),22.3B,22.4B,21.4B
2605,497511,07/05/2024,08:30,united kingdom,GBP,medium,S&P Global / CIPS UK Construction PMI  (Apr),53.0,50.4,50.2
2606,497521,07/05/2024,14:00,canada,CAD,medium,Ivey PMI  (Apr),63.0,58.1,57.5
2607,498485,07/05/2024,17:00,united states,USD,medium,3-Year Note Auction,4.605%,,4.548%
2608,497527,07/05/2024,19:00,united states,USD,medium,Consumer Credit  (Mar),6.27B,14.80B,15.02B
2609,498486,07/05/2024,20:30,united states,USD,medium,API Weekly Crude Oil Stock,0.509M,-1.430M,4.906M
2610,498529,08/05/2024,03:35,japan,JPY,medium,10-Year JGB Auction,0.857%,,0.753%
2611,497600,08/05/2024,06:00,germany,EUR,medium,German Industrial Production (MoM)  (Mar),-0.4%,-0.6%,1.7%
2612,498226,08/05/2024,07:30,sweden,SEK,medium,Interest Rate Decision,3.75%,3.75%,4.00%
2613,498532,08/05/2024,09:00,united kingdom,GBP,medium,Mortgage Rate (GBP)  (Apr),7.92%,,7.92%
2614,497633,08/05/2024,12:00,brazil,BRL,medium,Retail Sales (YoY)  (Mar),5.7%,5.2%,8.1%
2615,497631,08/05/2024,12:00,brazil,BRL,medium,Retail Sales (MoM)  (Mar),0.0%,-0.1%,1.0%
2616,498675,08/05/2024,14:30,united states,USD,high,Crude Oil Inventories,-1.362M,-1.430M,7.265M
2617,498671,08/05/2024,14:30,united states,USD,medium,Cushing Crude Oil Inventories,1.880M,,1.089M
2618,499002,08/05/2024,16:00,united states,USD,medium,Atlanta Fed GDPNow  (Q2),4.2%,3.3%,3.3%
2619,498535,08/05/2024,17:00,united states,USD,high,10-Year Note Auction,4.483%,,4.560%
2620,494652,08/05/2024,21:00,brazil,BRL,medium,Interest Rate Decision,10.50%,10.50%,10.75%
2621,498539,09/05/2024,01:30,australia,AUD,medium,Building Approvals (MoM),1.9%,1.9%,-0.9%
2622,498542,09/05/2024,03:00,china,CNY,medium,Exports (YoY)  (Apr),1.5%,1.0%,-7.5%
2623,498543,09/05/2024,03:00,china,CNY,medium,Imports (YoY)  (Apr),8.4%,5.4%,-1.9%
2624,498541,09/05/2024,03:00,china,CNY,medium,Trade Balance (USD)  (Apr),72.35B,81.40B,58.55B
2625,498212,09/05/2024,07:00,malaysia,MYR,medium,Interest Rate,3.00%,3.00%,3.00%
2626,497696,09/05/2024,11:00,united kingdom,GBP,medium,BoE MPC vote cut  (Apr),2,0,1
2627,497697,09/05/2024,11:00,united kingdom,GBP,medium,BoE MPC vote hike  (Apr),0,0,0
2628,497698,09/05/2024,11:00,united kingdom,GBP,medium,BoE MPC vote unchanged  (Apr),7,9,8
2629,490085,09/05/2024,11:00,united kingdom,GBP,high,BoE Interest Rate Decision  (Apr),5.25%,5.25%,5.25%
2630,497702,09/05/2024,12:00,mexico,MXN,medium,CPI (YoY)  (Apr),4.65%,4.63%,4.42%
2631,497704,09/05/2024,12:00,mexico,MXN,medium,CPI (MoM)  (Apr),0.20%,0.19%,0.29%
2632,497706,09/05/2024,12:00,poland,PLN,medium,Interest Rate Decision  (May),5.75%,,5.75%
2633,498363,09/05/2024,12:30,united states,USD,medium,Continuing Jobless Claims,"1,785K","1,790K","1,768K"
2634,498362,09/05/2024,12:30,united states,USD,high,Initial Jobless Claims,231K,212K,209K
2635,498552,09/05/2024,17:00,united states,USD,high,30-Year Bond Auction,4.635%,,4.671%
2636,490144,09/05/2024,19:00,mexico,MXN,medium,Interest Rate Decision  (May),11.00%,11.00%,11.00%
2637,498719,09/05/2024,20:30,united states,USD,medium,Fed's Balance Sheet,"7,353B",,"7,362B"
2638,497719,09/05/2024,22:30,new zealand,NZD,medium,Business NZ PMI  (Apr),48.9,,47.1
2639,497720,09/05/2024,23:30,japan,JPY,medium,Household Spending (YoY)  (Mar),-1.2%,-2.3%,-0.5%
2640,497721,09/05/2024,23:30,japan,JPY,medium,Household Spending (MoM)  (Mar),1.2%,-0.3%,1.4%
2641,497723,09/05/2024,23:50,japan,JPY,medium,Adjusted Current Account  (Mar),2.01T,2.04T,1.41T
2642,497724,09/05/2024,23:50,japan,JPY,medium,Current Account n.s.a.  (Mar),3.399T,3.489T,2.644T
2643,497759,10/05/2024,06:00,united kingdom,GBP,medium,Business Investment (QoQ)  (Q1),0.9%,1.9%,1.4%
2644,497764,10/05/2024,06:00,united kingdom,GBP,high,GDP (MoM)  (Mar),0.4%,0.1%,0.2%
2645,497750,10/05/2024,06:00,united kingdom,GBP,high,GDP (YoY)  (Q1),0.2%,0.0%,-0.2%
2646,497748,10/05/2024,06:00,united kingdom,GBP,high,GDP (QoQ)  (Q1),0.6%,0.4%,-0.3%
2647,497749,10/05/2024,06:00,united kingdom,GBP,medium,Industrial Production (MoM)  (Mar),0.2%,-0.5%,1.0%
2648,497751,10/05/2024,06:00,united kingdom,GBP,medium,Manufacturing Production (MoM)  (Mar),0.3%,-0.5%,1.2%
2649,497761,10/05/2024,06:00,united kingdom,GBP,medium,Monthly GDP 3M/3M Change  (Mar),0.6%,0.4%,0.2%
2650,497766,10/05/2024,06:00,united kingdom,GBP,medium,Trade Balance  (Mar),-13.97B,-14.50B,-14.13B
2651,497767,10/05/2024,06:00,united kingdom,GBP,medium,Trade Balance Non-EU  (Mar),-3.81B,,-2.78B
2652,498567,10/05/2024,11:40,united kingdom,GBP,medium,NIESR Monthly GDP Tracker,0.7%,,0.4%
2653,497804,10/05/2024,12:00,brazil,BRL,medium,CPI (YoY)  (Apr),3.69%,3.66%,3.93%
2654,497818,10/05/2024,12:30,canada,CAD,medium,Employment Change  (Apr),90.4K,20.9K,-2.2K
2655,497813,10/05/2024,12:30,canada,CAD,medium,Unemployment Rate  (Apr),6.1%,6.2%,6.1%
2656,497821,10/05/2024,14:00,united states,USD,medium,Michigan 1-Year Inflation Expectations  (May),3.5%,3.2%,3.2%
2657,497822,10/05/2024,14:00,united states,USD,medium,Michigan 5-Year Inflation Expectations  (May),3.1%,3.0%,3.0%
2658,497824,10/05/2024,14:00,united states,USD,medium,Michigan Consumer Expectations  (May),66.5,75.0,76.0
2659,497823,10/05/2024,14:00,united states,USD,medium,Michigan Consumer Sentiment  (May),67.4,76.0,77.2
2660,498368,10/05/2024,17:00,united states,USD,medium,U.S. Baker Hughes Oil Rig Count,496,,499
2661,498369,10/05/2024,17:00,united states,USD,medium,U.S. Baker Hughes Total Rig Count,603,,605
2662,497827,10/05/2024,18:00,united states,USD,medium,Federal Budget Balance  (Apr),210.0B,244.5B,-236.0B
2663,498785,10/05/2024,19:30,united kingdom,GBP,medium,CFTC GBP speculative net positions,-21.8K,,-29.0K
2664,498793,10/05/2024,19:30,united states,USD,medium,CFTC Crude Oil speculative net positions,215.4K,,265.5K
2665,498791,10/05/2024,19:30,united states,USD,medium,CFTC Gold speculative net positions,199.6K,,204.2K
2666,498783,10/05/2024,19:30,united states,USD,medium,CFTC Nasdaq 100 speculative net positions,4.4K,,2.8K
2667,498781,10/05/2024,19:30,united states,USD,medium,CFTC S&P 500 speculative net positions,-9.7K,,43.1K
2668,498778,10/05/2024,19:30,australia,AUD,medium,CFTC AUD speculative net positions,-64.5K,,-83.2K
2669,498784,10/05/2024,19:30,brazil,BRL,medium,CFTC BRL speculative net positions,-37.6K,,0.3K
2670,498777,10/05/2024,19:30,japan,JPY,medium,CFTC JPY speculative net positions,-134.9K,,-168.4K
2671,498788,10/05/2024,19:30,euro zone,EUR,medium,CFTC EUR speculative net positions,4.6K,,-6.8K
2672,499840,10/05/2024,20:30,russia,RUB,medium,CFTC RUB speculative positions,,,-41.1K
2673,497849,11/05/2024,01:30,china,CNY,medium,CPI (MoM)  (Apr),0.1%,,-1.0%
2674,497851,11/05/2024,01:30,china,CNY,medium,CPI (YoY)  (Apr),0.3%,0.1%,0.1%
2675,497850,11/05/2024,01:30,china,CNY,medium,PPI (YoY)  (Apr),-2.5%,-2.3%,-2.8%
2676,498571,11/05/2024,16:20,china,CNY,medium,New Loans  (Apr),730.0B,"1,200.0B","3,090.0B"
2677,497878,13/05/2024,01:30,australia,AUD,medium,NAB Business Confidence  (Apr),1,,1
2678,498882,13/05/2024,03:00,new zealand,NZD,medium,Inflation Expectations (QoQ),2.3%,,2.5%
2679,497883,13/05/2024,07:00,switzerland,CHF,medium,SECO Consumer Climate  (Q2),-24,-40,-38
2680,498884,13/05/2024,07:00,türkiye,TRY,medium,Turkish Retail Sales (YoY),19.4%,,25.2%
2681,498883,13/05/2024,07:00,türkiye,TRY,medium,Turkish Retail Sales (MoM),0.0%,,3.6%
2682,497908,13/05/2024,12:00,india,INR,medium,CPI (YoY)  (Apr),4.83%,4.80%,4.85%
2683,497909,13/05/2024,12:30,canada,CAD,medium,Building Permits (MoM)  (Mar),-11.7%,-4.6%,8.9%
2684,498886,13/05/2024,15:00,united states,USD,medium,NY Fed 1-Year Consumer Inflation Expectations,3.3%,,3.0%
2685,497914,13/05/2024,22:45,new zealand,NZD,medium,Electronic Card Retail Sales (MoM)  (Apr),-0.4%,,-0.7%
2686,497943,14/05/2024,06:00,united kingdom,GBP,medium,Average Earnings Index +Bonus  (Mar),5.7%,5.3%,5.7%
2687,497947,14/05/2024,06:00,united kingdom,GBP,medium,Claimant Count Change  (Apr),8.9K,13.9K,-2.4K
2688,497941,14/05/2024,06:00,united kingdom,GBP,medium,Employment Change 3M/3M (MoM)  (Mar),-177K,-215K,-156K
2689,498899,14/05/2024,06:00,united kingdom,GBP,medium,Labour Productivity  (Q4),-0.3%,-1.0%,0.5%
2690,497942,14/05/2024,06:00,united kingdom,GBP,medium,Unemployment Rate  (Mar),4.3%,4.3%,4.2%
2691,497938,14/05/2024,06:00,germany,EUR,medium,German CPI (YoY)  (Apr),2.2%,2.2%,2.2%
2692,497939,14/05/2024,06:00,germany,EUR,high,German CPI (MoM)  (Apr),0.5%,0.5%,0.4%
2693,497953,14/05/2024,06:30,switzerland,CHF,medium,PPI (MoM)  (Apr),0.6%,0.2%,0.1%
2694,497949,14/05/2024,06:30,india,INR,medium,WPI Inflation (YoY)  (Apr),1.26%,1.00%,0.53%
2695,497957,14/05/2024,07:00,spain,EUR,medium,Spanish CPI (YoY)  (Apr),3.3%,3.3%,3.2%
2696,497956,14/05/2024,07:00,spain,EUR,medium,Spanish HICP (YoY)  (Apr),3.4%,3.4%,3.3%
2697,499394,14/05/2024,08:31,united kingdom,GBP,medium,Labour Productivity  (Q1),-0.3%,,-0.9%
2698,497966,14/05/2024,09:00,germany,EUR,medium,German ZEW Current Conditions  (May),-72.3,-75.0,-79.2
2699,497965,14/05/2024,09:00,germany,EUR,medium,German ZEW Economic Sentiment  (May),47.1,44.9,42.9
2700,497967,14/05/2024,09:00,euro zone,EUR,medium,ZEW Economic Sentiment  (May),47.0,46.1,43.9
2701,497998,14/05/2024,12:30,united states,USD,medium,Core PPI (MoM)  (Apr),0.5%,0.2%,-0.1%
2702,497997,14/05/2024,12:30,united states,USD,high,PPI (MoM)  (Apr),0.5%,0.3%,-0.1%
2703,498000,14/05/2024,12:30,canada,CAD,medium,Wholesale Sales (MoM)  (Mar),-1.1%,-0.9%,0.2%
2704,498898,14/05/2024,20:30,united states,USD,medium,API Weekly Crude Oil Stock,-3.104M,-1.350M,0.509M
2705,498011,15/05/2024,01:30,australia,AUD,medium,Wage Price Index (QoQ)  (Q1),0.8%,0.9%,1.0%
2706,498099,15/05/2024,06:00,sweden,SEK,medium,CPI (YoY)  (Apr),3.9%,4.0%,4.1%
2707,498100,15/05/2024,06:00,sweden,SEK,medium,CPI (MoM)  (Apr),0.3%,0.4%,0.1%
2708,498107,15/05/2024,06:45,france,EUR,medium,French CPI (MoM)  (Apr),0.5%,0.5%,0.2%
2709,498110,15/05/2024,06:45,france,EUR,medium,French HICP (MoM)  (Apr),0.6%,0.6%,0.2%
2710,498116,15/05/2024,08:00,poland,PLN,medium,GDP (YoY)  (Q1),1.9%,1.8%,1.0%
2711,498117,15/05/2024,08:00,poland,PLN,medium,GDP (QoQ)  (Q1),0.4%,0.7%,-0.1%
2712,498123,15/05/2024,09:00,euro zone,EUR,medium,GDP (YoY)  (Q1),0.4%,0.4%,0.1%
2713,498907,15/05/2024,09:00,euro zone,EUR,medium,GDP (QoQ),0.3%,0.3%,-0.1%
2714,498126,15/05/2024,09:00,euro zone,EUR,medium,Industrial Production (MoM)  (Mar),0.6%,0.5%,1.0%
2715,498140,15/05/2024,12:15,canada,CAD,medium,Housing Starts  (Apr),240.2K,239.0K,242.3K
2716,498148,15/05/2024,12:30,united states,USD,high,Core CPI (MoM)  (Apr),0.3%,0.3%,0.4%
2717,498146,15/05/2024,12:30,united states,USD,medium,Core CPI (YoY)  (Apr),3.6%,3.6%,3.8%
2718,498144,15/05/2024,12:30,united states,USD,high,Core Retail Sales (MoM)  (Apr),0.2%,0.2%,0.9%
2719,498147,15/05/2024,12:30,united states,USD,high,CPI (MoM)  (Apr),0.3%,0.4%,0.4%
2720,498149,15/05/2024,12:30,united states,USD,high,CPI (YoY)  (Apr),3.4%,3.4%,3.5%
2721,498150,15/05/2024,12:30,united states,USD,medium,NY Empire State Manufacturing Index  (May),-15.60,-9.90,-14.30
2722,498141,15/05/2024,12:30,united states,USD,medium,Retail Control (MoM)  (Apr),-0.3%,,1.0%
2723,498145,15/05/2024,12:30,united states,USD,high,Retail Sales (MoM)  (Apr),0.0%,0.4%,0.6%
2724,498164,15/05/2024,14:00,united states,USD,medium,Business Inventories (MoM)  (Mar),-0.1%,0.0%,0.3%
2725,498163,15/05/2024,14:00,united states,USD,medium,Retail Inventories Ex Auto  (Mar),-0.2%,-0.1%,-0.1%
2726,499106,15/05/2024,14:30,united states,USD,high,Crude Oil Inventories,-2.508M,-0.400M,-1.362M
2727,499115,15/05/2024,14:30,united states,USD,medium,Cushing Crude Oil Inventories,-0.341M,,1.880M
2728,499007,15/05/2024,17:00,united states,USD,medium,Atlanta Fed GDPNow  (Q2),3.8%,4.2%,4.2%
2729,498173,15/05/2024,20:00,united states,USD,medium,TIC Net Long-Term Transactions  (Mar),100.5B,89.3B,62.9B
2730,498181,15/05/2024,23:50,japan,JPY,medium,GDP (YoY)  (Q1),-2.0%,-1.5%,0.0%
2731,498178,15/05/2024,23:50,japan,JPY,high,GDP (QoQ)  (Q1),-0.5%,-0.3%,0.0%
2732,498182,15/05/2024,23:50,japan,JPY,medium,GDP Price Index (YoY)  (Q1),3.7%,3.3%,3.9%
2733,498186,16/05/2024,01:30,australia,AUD,medium,Employment Change  (Apr),38.5K,22.4K,-5.9K
2734,498185,16/05/2024,01:30,australia,AUD,medium,Full Employment Change  (Apr),-6.1K,,26.6K
2735,498184,16/05/2024,01:30,australia,AUD,medium,Unemployment Rate  (Apr),4.1%,3.9%,3.9%
2736,499145,16/05/2024,04:30,japan,JPY,medium,Industrial Production (MoM)  (Mar),4.4%,3.8%,-0.6%
2737,498233,16/05/2024,12:30,united states,USD,medium,Building Permits  (Apr),1.440M,1.480M,1.485M
2738,498813,16/05/2024,12:30,united states,USD,medium,Continuing Jobless Claims,"1,794K","1,780K","1,781K"
2739,498229,16/05/2024,12:30,united states,USD,medium,Export Price Index (MoM)  (Apr),0.5%,0.4%,0.1%
2740,498240,16/05/2024,12:30,united states,USD,medium,Housing Starts (MoM)  (Apr),5.7%,,-16.8%
2741,498231,16/05/2024,12:30,united states,USD,medium,Housing Starts  (Apr),1.360M,1.420M,1.287M
2742,498230,16/05/2024,12:30,united states,USD,medium,Import Price Index (MoM)  (Apr),0.9%,0.2%,0.6%
2743,498812,16/05/2024,12:30,united states,USD,high,Initial Jobless Claims,222K,219K,232K
