,id,date,time,zone,currency,importance,event,actual,forecast,previous
1106,490752,18/01/2024,13:30,united states,USD,high,Initial Jobless Claims,187K,207K,203K
1107,489921,18/01/2024,13:30,united states,USD,high,Philadelphia Fed Manufacturing Index  (Jan),-10.6,-7.0,-12.8
1108,489925,18/01/2024,13:30,united states,USD,medium,Philly Fed Employment  (Jan),-1.8,,-2.5
1109,491000,18/01/2024,16:00,united states,USD,high,Crude Oil Inventories,-2.492M,-0.313M,1.338M
1110,491070,18/01/2024,16:00,united states,USD,medium,Cushing Crude Oil Inventories,-2.099M,,-0.506M
1111,489316,18/01/2024,16:30,united states,USD,medium,Atlanta Fed GDPNow  (Q4),2.4%,2.4%,2.4%
1112,490918,18/01/2024,18:00,united states,USD,medium,10-Year TIPS Auction,1.810%,,2.180%
1113,491009,18/01/2024,21:30,united states,USD,medium,Fed's Balance Sheet,"7,674B",,"7,687B"
1114,489932,18/01/2024,21:30,new zealand,NZD,medium,Business NZ PMI  (Dec),43.1,,46.5
1115,489934,18/01/2024,23:30,japan,JPY,medium,National Core CPI (YoY)  (Dec),2.3%,2.3%,2.5%
1116,494238,18/01/2024,23:30,japan,JPY,medium,National CPI (MoM),0.1%,,-0.1%
1117,498940,19/01/2024,04:30,japan,JPY,medium,Tertiary Industry Activity Index (MoM),-0.7%,,-0.2%
1118,490297,19/01/2024,07:00,united kingdom,GBP,medium,Core Retail Sales (MoM)  (Dec),-3.3%,-0.6%,1.5%
1119,490298,19/01/2024,07:00,united kingdom,GBP,medium,Core Retail Sales (YoY)  (Dec),-2.1%,1.3%,0.5%
1120,490295,19/01/2024,07:00,united kingdom,GBP,medium,Retail Sales (MoM)  (Dec),-3.2%,-0.5%,1.4%
1121,490296,19/01/2024,07:00,united kingdom,GBP,medium,Retail Sales (YoY)  (Dec),-2.4%,1.1%,0.2%
1122,489963,19/01/2024,07:00,germany,EUR,medium,German PPI (MoM)  (Dec),-1.2%,-0.5%,-0.5%
1123,489966,19/01/2024,07:30,switzerland,CHF,medium,PPI (MoM)  (Dec),-0.6%,-0.6%,-0.9%
1124,489995,19/01/2024,13:30,canada,CAD,medium,Core Retail Sales (MoM)  (Nov),-0.5%,-0.1%,0.4%
1125,489996,19/01/2024,13:30,canada,CAD,medium,Retail Sales (MoM)  (Nov),-0.2%,0.0%,0.5%
1126,490008,19/01/2024,15:00,united states,USD,medium,Existing Home Sales (MoM)  (Dec),-1.0%,0.3%,0.8%
1127,490007,19/01/2024,15:00,united states,USD,high,Existing Home Sales  (Dec),3.78M,3.82M,3.82M
1128,490005,19/01/2024,15:00,united states,USD,medium,Michigan 1-Year Inflation Expectations  (Jan),2.9%,3.1%,3.1%
1129,490006,19/01/2024,15:00,united states,USD,medium,Michigan 5-Year Inflation Expectations  (Jan),2.8%,3.0%,2.9%
1130,490003,19/01/2024,15:00,united states,USD,medium,Michigan Consumer Expectations  (Jan),75.9,67.0,67.4
1131,490002,19/01/2024,15:00,united states,USD,medium,Michigan Consumer Sentiment  (Jan),78.8,70.0,69.7
1132,489317,19/01/2024,18:00,united states,USD,medium,Atlanta Fed GDPNow  (Q4),2.4%,2.4%,2.4%
1133,490748,19/01/2024,18:00,united states,USD,medium,U.S. Baker Hughes Oil Rig Count,497,,499
1134,490749,19/01/2024,18:00,united states,USD,medium,U.S. Baker Hughes Total Rig Count,620,,619
1135,491082,19/01/2024,20:30,united kingdom,GBP,medium,CFTC GBP speculative net positions,30.9K,,20.7K
1136,491090,19/01/2024,20:30,united states,USD,medium,CFTC Crude Oil speculative net positions,162.0K,,169.7K
1137,491088,19/01/2024,20:30,united states,USD,medium,CFTC Gold speculative net positions,179.9K,,188.6K
1138,491080,19/01/2024,20:30,united states,USD,medium,CFTC Nasdaq 100 speculative net positions,36.6K,,36.8K
1139,491078,19/01/2024,20:30,united states,USD,medium,CFTC S&P 500 speculative net positions,-169.2K,,-117.0K
1140,491075,19/01/2024,20:30,australia,AUD,medium,CFTC AUD speculative net positions,-47.9K,,-32.3K
1141,491081,19/01/2024,20:30,brazil,BRL,medium,CFTC BRL speculative net positions,24.7K,,25.1K
1142,491074,19/01/2024,20:30,japan,JPY,medium,CFTC JPY speculative net positions,-56.6K,,-55.9K
1143,491077,19/01/2024,20:30,russia,RUB,medium,CFTC RUB speculative positions,-3.7K,,-4.4K
1144,491085,19/01/2024,20:30,euro zone,EUR,medium,CFTC EUR speculative net positions,104.1K,,118.9K
1145,490047,19/01/2024,21:00,united states,USD,medium,TIC Net Long-Term Transactions  (Nov),126.1B,,3.4B
1146,490058,22/01/2024,01:15,china,CNY,medium,China Loan Prime Rate 5Y  (Jan),4.20%,4.20%,4.20%
1147,491268,22/01/2024,01:15,china,CNY,medium,PBoC Loan Prime Rate,3.45%,3.45%,3.45%
1148,490060,22/01/2024,04:00,malaysia,MYR,medium,CPI (YoY)  (Dec),1.5%,1.5%,1.5%
1149,490155,22/01/2024,15:00,united states,USD,medium,US Leading Index (MoM)  (Dec),-0.1%,-0.3%,-0.5%
1150,490184,23/01/2024,00:30,australia,AUD,medium,NAB Business Confidence  (Dec),-1,,-8
1151,490104,23/01/2024,03:00,japan,JPY,high,BoJ Interest Rate Decision,-0.10%,-0.10%,-0.10%
1152,491512,23/01/2024,05:00,japan,JPY,medium,BoJ Core CPI (YoY),2.6%,2.8%,2.7%
1153,490189,23/01/2024,05:00,singapore,SGD,medium,Core CPI (YoY)  (Dec),3.30%,3.10%,3.20%
1154,490190,23/01/2024,05:00,singapore,SGD,medium,CPI (YoY)  (Dec),3.7%,3.5%,3.6%
1155,490384,23/01/2024,13:30,canada,CAD,medium,New Housing Price Index (MoM)  (Dec),0.0%,0.0%,-0.2%
1156,491280,23/01/2024,18:00,united states,USD,medium,2-Year Note Auction,4.365%,,4.314%
1157,491281,23/01/2024,21:30,united states,USD,medium,API Weekly Crude Oil Stock,-6.674M,-3.000M,0.483M
1158,490214,23/01/2024,21:45,new zealand,NZD,medium,CPI (YoY)  (Q4),4.7%,4.7%,5.6%
1159,490215,23/01/2024,21:45,new zealand,NZD,medium,CPI (QoQ)  (Q4),0.5%,0.5%,1.8%
1160,491514,23/01/2024,23:50,japan,JPY,medium,Adjusted Trade Balance,-0.41T,-0.45T,-0.35T
1161,490218,23/01/2024,23:50,japan,JPY,medium,Exports (YoY)  (Dec),9.8%,9.1%,-0.2%
1162,490216,23/01/2024,23:50,japan,JPY,medium,Trade Balance  (Dec),62.1B,-122.1B,-780.4B
1163,491377,24/01/2024,00:30,japan,JPY,medium,au Jibun Bank Japan Services PMI,52.7,,51.5
1164,490780,24/01/2024,07:00,malaysia,MYR,medium,Interest Rate,3.00%,3.00%,3.00%
1165,491773,24/01/2024,07:55,china,CNY,medium,PBoC Reserve Requirement Ratio,10.00%,,10.50%
1166,490281,24/01/2024,08:15,france,EUR,medium,HCOB France Manufacturing PMI  (Jan),43.2,42.5,42.1
1167,490283,24/01/2024,08:15,france,EUR,medium,HCOB France Services PMI  (Jan),45.0,46.0,45.7
1168,490286,24/01/2024,08:30,germany,EUR,medium,HCOB Germany Manufacturing PMI  (Jan),45.4,43.7,43.3
1169,490288,24/01/2024,08:30,germany,EUR,medium,HCOB Germany Services PMI  (Jan),47.6,49.5,49.3
1170,490290,24/01/2024,09:00,euro zone,EUR,medium,HCOB Eurozone Manufacturing PMI  (Jan),46.6,44.8,44.4
1171,490292,24/01/2024,09:00,euro zone,EUR,medium,HCOB Eurozone Composite PMI  (Jan),47.9,48.0,47.6
1172,490291,24/01/2024,09:00,euro zone,EUR,medium,HCOB Eurozone Services PMI  (Jan),48.4,49.0,48.8
1173,491387,24/01/2024,09:30,united kingdom,GBP,medium,S&P Global/CIPS UK Composite PMI,52.5,52.2,52.1
1174,491515,24/01/2024,09:30,united kingdom,GBP,medium,S&P Global/CIPS UK Manufacturing PMI,47.3,46.7,46.2
1175,491386,24/01/2024,09:30,united kingdom,GBP,medium,S&P Global/CIPS UK Services PMI,53.8,53.2,53.4
1176,490325,24/01/2024,14:45,united states,USD,high,S&P Global US Manufacturing PMI  (Jan),50.3,47.9,47.9
1177,490324,24/01/2024,14:45,united states,USD,medium,S&P Global Composite PMI  (Jan),52.3,,50.9
1178,490326,24/01/2024,14:45,united states,USD,high,S&P Global Services PMI  (Jan),52.9,51.0,51.4
1179,490096,24/01/2024,14:45,canada,CAD,high,BoC Interest Rate Decision,5.00%,5.00%,5.00%
1180,491516,24/01/2024,15:30,united states,USD,high,Crude Oil Inventories,-9.233M,-2.150M,-2.492M
1181,491583,24/01/2024,15:30,united states,USD,medium,Cushing Crude Oil Inventories,-2.008M,,-2.099M
1182,491397,24/01/2024,18:00,united states,USD,medium,5-Year Note Auction,4.055%,,3.801%
1183,490409,25/01/2024,09:00,germany,EUR,medium,German Business Expectations  (Jan),83.5,84.8,84.2
1184,490408,25/01/2024,09:00,germany,EUR,medium,German Current Assessment  (Jan),87.0,88.6,88.5
1185,490410,25/01/2024,09:00,germany,EUR,medium,German Ifo Business Climate Index  (Jan),85.2,86.7,86.3
1186,490134,25/01/2024,09:00,norway,NOK,medium,Interest Rate Decision,4.50%,4.50%,4.50%
1187,491446,25/01/2024,11:00,france,EUR,medium,France Jobseekers Total,"2,825.2K",,"2,826.6K"
1188,490413,25/01/2024,11:00,türkiye,TRY,medium,One-Week Repo Rate  (Jan),45.00%,45.00%,42.50%
1189,491456,25/01/2024,12:40,united states,USD,medium,Building Permits,1.493M,1.495M,1.467M
1190,490428,25/01/2024,13:00,south africa,ZAR,medium,Interest Rate Decision  (Jan),8.25%,,8.25%
1191,490429,25/01/2024,13:15,euro zone,EUR,high,Deposit Facility Rate  (Jan),4.00%,4.00%,4.00%
1192,491449,25/01/2024,13:15,euro zone,EUR,medium,ECB Marginal Lending Facility,4.75%,,4.75%
1193,490075,25/01/2024,13:15,euro zone,EUR,high,ECB Interest Rate Decision  (Jan),4.50%,4.50%,4.50%
1194,491270,25/01/2024,13:30,united states,USD,medium,Continuing Jobless Claims,"1,833K","1,828K","1,806K"
1195,490436,25/01/2024,13:30,united states,USD,medium,Core Durable Goods Orders (MoM)  (Dec),0.6%,0.2%,0.5%
1196,490433,25/01/2024,13:30,united states,USD,medium,Core PCE Prices  (Q4),2.00%,2.00%,2.00%
1197,490437,25/01/2024,13:30,united states,USD,high,Durable Goods Orders (MoM)  (Dec),0.0%,1.1%,5.5%
1198,490431,25/01/2024,13:30,united states,USD,high,GDP (QoQ)  (Q4),3.3%,2.0%,4.9%
1199,490435,25/01/2024,13:30,united states,USD,medium,GDP Price Index (QoQ)  (Q4),1.5%,2.3%,3.3%
1200,490442,25/01/2024,13:30,united states,USD,medium,Goods Trade Balance  (Dec),-88.46B,-88.70B,-90.27B
1201,491269,25/01/2024,13:30,united states,USD,high,Initial Jobless Claims,214K,200K,189K
1202,490440,25/01/2024,13:30,united states,USD,medium,Retail Inventories Ex Auto  (Dec),0.6%,,-0.6%
1203,490447,25/01/2024,15:00,united states,USD,high,New Home Sales  (Dec),664K,645K,615K
1204,490446,25/01/2024,15:00,united states,USD,medium,New Home Sales (MoM)  (Dec),8.0%,,-9.0%
1205,491454,25/01/2024,18:00,united states,USD,medium,7-Year Note Auction,4.109%,,3.859%
1206,491520,25/01/2024,21:30,united states,USD,medium,Fed's Balance Sheet,"7,677B",,"7,674B"
1207,490699,25/01/2024,23:30,japan,JPY,medium,Tokyo Core CPI (YoY)  (Jan),1.6%,1.9%,2.1%
1208,490473,26/01/2024,07:00,germany,EUR,medium,GfK German Consumer Climate  (Feb),-29.7,-24.5,-25.4
1209,490518,26/01/2024,13:30,united states,USD,high,Core PCE Price Index (MoM)  (Dec),0.2%,0.2%,0.1%
1210,490521,26/01/2024,13:30,united states,USD,high,Core PCE Price Index (YoY)  (Dec),2.9%,3.0%,3.2%
1211,490520,26/01/2024,13:30,united states,USD,medium,PCE price index (MoM)  (Dec),0.2%,0.2%,-0.1%
1212,490517,26/01/2024,13:30,united states,USD,medium,PCE Price index (YoY)  (Dec),2.6%,2.6%,2.6%
1213,490519,26/01/2024,13:30,united states,USD,medium,Personal Spending (MoM)  (Dec),0.7%,0.4%,0.4%
1214,491468,26/01/2024,13:30,canada,CAD,medium,Wholesale Sales (MoM),0.8%,,0.9%
1215,490525,26/01/2024,15:00,united states,USD,medium,Pending Home Sales (MoM)  (Dec),8.3%,1.5%,0.0%
1216,491274,26/01/2024,18:00,united states,USD,medium,U.S. Baker Hughes Oil Rig Count,499,,497
1217,491275,26/01/2024,18:00,united states,USD,medium,U.S. Baker Hughes Total Rig Count,621,,620
1218,491592,26/01/2024,20:30,united kingdom,GBP,medium,CFTC GBP speculative net positions,31.4K,,30.9K
1219,491600,26/01/2024,20:30,united states,USD,medium,CFTC Crude Oil speculative net positions,184.0K,,162.0K
1220,491598,26/01/2024,20:30,united states,USD,medium,CFTC Gold speculative net positions,169.5K,,179.9K
1221,491590,26/01/2024,20:30,united states,USD,medium,CFTC Nasdaq 100 speculative net positions,33.0K,,36.6K
1222,491588,26/01/2024,20:30,united states,USD,medium,CFTC S&P 500 speculative net positions,-189.5K,,-169.2K
1223,491585,26/01/2024,20:30,australia,AUD,medium,CFTC AUD speculative net positions,-54.1K,,-47.9K
1224,491591,26/01/2024,20:30,brazil,BRL,medium,CFTC BRL speculative net positions,23.8K,,24.7K
1225,491584,26/01/2024,20:30,japan,JPY,medium,CFTC JPY speculative net positions,-70.6K,,-56.6K
1226,491587,26/01/2024,20:30,russia,RUB,medium,CFTC RUB speculative positions,-5.2K,,-3.7K
1227,491595,26/01/2024,20:30,euro zone,EUR,medium,CFTC EUR speculative net positions,88.3K,,104.1K
1228,490600,29/01/2024,07:00,sweden,SEK,medium,GDP (QoQ)  (Q4),0.1%,0.3%,-0.3%
1229,490601,29/01/2024,07:00,sweden,SEK,medium,GDP (YoY)  (Q4),0.0%,,-1.4%
1230,490718,30/01/2024,00:30,australia,AUD,medium,Retail Sales (MoM)  (Dec),-2.7%,-1.0%,1.6%
1231,491095,30/01/2024,06:30,france,EUR,medium,French Consumer Spending (MoM)  (Dec),0.3%,0.3%,0.6%
1232,490628,30/01/2024,06:30,france,EUR,medium,French GDP (YoY)  (Q4),0.7%,,0.6%
1233,490629,30/01/2024,06:30,france,EUR,medium,French GDP (QoQ)  (Q4),0.0%,0.0%,0.0%
1234,490635,30/01/2024,08:00,switzerland,CHF,medium,KOF Leading Indicators  (Jan),101.5,98.2,98.0
1235,490638,30/01/2024,08:00,spain,EUR,medium,Spanish CPI (YoY)  (Jan),3.4%,3.1%,3.1%
1236,490636,30/01/2024,08:00,spain,EUR,medium,Spanish GDP (QoQ)  (Q4),0.6%,0.2%,0.4%
1237,490642,30/01/2024,08:00,spain,EUR,medium,Spanish HICP (YoY)  (Jan),3.5%,3.1%,3.3%
1238,490818,30/01/2024,09:00,germany,EUR,high,German GDP (QoQ)  (Q4),-0.3%,-0.3%,-0.1%
1239,490817,30/01/2024,09:00,germany,EUR,medium,German GDP (YoY)  (Q4),-0.2%,-0.2%,-0.4%
1240,491381,30/01/2024,10:00,euro zone,EUR,medium,GDP (YoY)  (Q4),0.1%,0.0%,0.0%
1241,491380,30/01/2024,10:00,euro zone,EUR,medium,GDP (QoQ)  (Q4),0.0%,-0.1%,-0.1%
1242,491727,30/01/2024,10:30,italy,EUR,medium,Italian 10-Year BTP Auction,3.69%,,4.17%
1243,490674,30/01/2024,12:00,mexico,MXN,medium,GDP (QoQ)  (Q4),0.1%,0.4%,1.1%
1244,490675,30/01/2024,12:00,mexico,MXN,medium,GDP (YoY)  (Q4),2.4%,3.1%,3.3%
1245,490686,30/01/2024,14:00,united states,USD,medium,S&P/CS HPI Composite - 20 n.s.a. (MoM)  (Nov),-0.2%,,0.1%
1246,490685,30/01/2024,14:00,united states,USD,medium,S&P/CS HPI Composite - 20 n.s.a. (YoY)  (Nov),5.4%,5.8%,4.9%
1247,490693,30/01/2024,15:00,united states,USD,high,CB Consumer Confidence  (Jan),114.8,114.2,108.0
1248,490689,30/01/2024,15:00,united states,USD,high,JOLTS Job Openings  (Dec),9.026M,8.750M,8.925M
1249,491733,30/01/2024,21:30,united states,USD,medium,API Weekly Crude Oil Stock,-2.500M,-0.867M,-6.674M
1250,490707,30/01/2024,23:50,japan,JPY,medium,Industrial Production (MoM)  (Dec),1.8%,2.4%,-0.9%
1251,490711,31/01/2024,00:30,australia,AUD,medium,CPI (QoQ)  (Q4),0.6%,0.8%,1.2%
1252,490710,31/01/2024,00:30,australia,AUD,medium,CPI (YoY)  (Q4),4.1%,4.3%,5.4%
1253,490716,31/01/2024,00:30,australia,AUD,medium,Trimmed Mean CPI (QoQ)  (Q4),0.8%,0.9%,1.2%
1254,490720,31/01/2024,01:30,china,CNY,medium,Chinese Composite PMI  (Jan),50.9,,50.3
1255,490719,31/01/2024,01:30,china,CNY,high,Manufacturing PMI  (Jan),49.2,49.2,49.0
1256,490721,31/01/2024,01:30,china,CNY,medium,Non-Manufacturing PMI  (Jan),50.7,50.6,50.4
1257,491798,31/01/2024,07:00,united kingdom,GBP,medium,Nationwide HPI (MoM)  (Jan),0.7%,0.1%,0.0%
1258,491799,31/01/2024,07:00,united kingdom,GBP,medium,Nationwide HPI (YoY)  (Jan),-0.2%,-0.9%,-1.8%
1259,490771,31/01/2024,07:00,germany,EUR,medium,German Retail Sales (MoM)  (Dec),-1.6%,0.7%,-0.8%
1260,490787,31/01/2024,07:45,france,EUR,medium,French CPI (MoM)  (Jan),-0.2%,0.0%,0.1%
1261,491781,31/01/2024,07:45,france,EUR,medium,French HICP (MoM),-0.2%,-0.2%,0.1%
1262,490799,31/01/2024,08:55,germany,EUR,medium,German Unemployment Change  (Jan),-2K,11K,2K
1263,490796,31/01/2024,08:55,germany,EUR,medium,German Unemployment Rate  (Jan),5.8%,5.9%,5.8%
1264,491786,31/01/2024,10:30,germany,EUR,medium,German 10-Year Bund Auction,2.230%,,2.190%
1265,468465,31/01/2024,12:00,brazil,BRL,medium,Unemployment Rate,7.4%,7.6%,7.5%
1266,490844,31/01/2024,13:00,germany,EUR,medium,German CPI (YoY)  (Jan),2.9%,3.0%,3.7%
1267,490845,31/01/2024,13:00,germany,EUR,high,German CPI (MoM)  (Jan),0.2%,0.2%,0.1%
1268,490846,31/01/2024,13:15,united states,USD,high,ADP Nonfarm Employment Change  (Jan),107K,145K,158K
1269,490848,31/01/2024,13:30,united states,USD,medium,Employment Cost Index (QoQ)  (Q4),0.9%,1.0%,1.1%
1270,490850,31/01/2024,13:30,canada,CAD,medium,GDP (MoM)  (Nov),0.2%,0.1%,0.0%
1271,491791,31/01/2024,13:31,canada,CAD,medium,GDP (MoM)  (Dec),0.3%,,0.2%
1272,490853,31/01/2024,14:45,united states,USD,high,Chicago PMI  (Jan),46.0,48.0,47.2
1273,492008,31/01/2024,15:30,united states,USD,high,Crude Oil Inventories,1.234M,-0.217M,-9.233M
1274,492006,31/01/2024,15:30,united states,USD,medium,Cushing Crude Oil Inventories,-1.972M,,-2.008M
1275,472443,31/01/2024,19:00,united states,USD,high,Fed Interest Rate Decision,5.50%,5.50%,5.50%
1276,492353,31/01/2024,21:00,brazil,BRL,medium,Interest Rate Decision,11.25%,11.25%,11.75%
1277,490869,01/02/2024,00:30,australia,AUD,medium,Building Approvals (MoM)  (Dec),-9.5%,0.5%,0.3%
1278,490878,01/02/2024,01:45,china,CNY,medium,Caixin Manufacturing PMI  (Jan),50.8,50.8,50.8
1279,491874,01/02/2024,03:35,japan,JPY,medium,10-Year JGB Auction,0.741%,,0.596%
1280,490939,01/02/2024,08:15,spain,EUR,medium,HCOB Spain Manufacturing PMI  (Jan),49.2,47.9,46.2
1281,491484,01/02/2024,08:30,sweden,SEK,medium,Interest Rate Decision,4.00%,4.00%,4.00%
1282,490942,01/02/2024,08:30,switzerland,CHF,medium,procure.ch PMI  (Jan),43.1,44.5,43.0
1283,490943,01/02/2024,08:45,italy,EUR,medium,HCOB Italy Manufacturing PMI  (Jan),48.5,47.0,45.3
1284,490944,01/02/2024,08:50,france,EUR,medium,HCOB France Manufacturing PMI  (Jan),43.1,43.2,42.1
1285,490945,01/02/2024,08:55,germany,EUR,medium,HCOB Germany Manufacturing PMI  (Jan),45.5,45.4,43.3
1286,490950,01/02/2024,09:00,euro zone,EUR,medium,HCOB Eurozone Manufacturing PMI  (Jan),46.6,46.6,44.4
1287,490953,01/02/2024,09:30,united kingdom,GBP,medium,S&P Global/CIPS UK Manufacturing PMI  (Jan),47.0,47.3,46.2
1288,491884,01/02/2024,10:00,euro zone,EUR,medium,Core CPI (YoY)  (Jan),3.3%,3.2%,3.4%
1289,491885,01/02/2024,10:00,euro zone,EUR,medium,CPI (MoM)  (Jan),-0.4%,-0.4%,0.2%
1290,490957,01/02/2024,10:00,euro zone,EUR,high,CPI (YoY)  (Jan),2.8%,2.7%,2.9%
1291,491415,01/02/2024,10:00,euro zone,EUR,medium,Unemployment Rate  (Dec),6.4%,6.4%,6.4%
1292,490963,01/02/2024,12:00,united kingdom,GBP,medium,BoE MPC vote cut  (Feb),1,0,0
1293,490966,01/02/2024,12:00,united kingdom,GBP,medium,BoE MPC vote hike  (Feb),2,2,3
1294,490964,01/02/2024,12:00,united kingdom,GBP,medium,BoE MPC vote unchanged  (Feb),6,7,6
1295,490083,01/02/2024,12:00,united kingdom,GBP,high,BoE Interest Rate Decision  (Jan),5.25%,5.25%,5.25%
1296,491803,01/02/2024,13:30,united states,USD,medium,Continuing Jobless Claims,"1,898K","1,840K","1,828K"
1297,491802,01/02/2024,13:30,united states,USD,high,Initial Jobless Claims,224K,213K,215K
1298,490972,01/02/2024,13:30,united states,USD,medium,Nonfarm Productivity (QoQ)  (Q4),3.2%,2.4%,4.9%
1299,490971,01/02/2024,13:30,united states,USD,medium,Unit Labor Costs (QoQ)  (Q4),0.5%,1.3%,-1.1%
1300,490975,01/02/2024,14:45,united states,USD,high,S&P Global US Manufacturing PMI  (Jan),50.7,50.3,47.9
1301,490977,01/02/2024,15:00,united states,USD,medium,Construction Spending (MoM)  (Dec),0.9%,0.5%,0.9%
1302,490980,01/02/2024,15:00,united states,USD,medium,ISM Manufacturing Employment  (Jan),47.1,47.0,47.5
1303,490979,01/02/2024,15:00,united states,USD,high,ISM Manufacturing PMI  (Jan),49.1,47.2,47.1
1304,490981,01/02/2024,15:00,united states,USD,high,ISM Manufacturing Prices  (Jan),52.9,46.0,45.2
1305,491993,01/02/2024,17:45,united states,USD,medium,Atlanta Fed GDPNow  (Q1),4.2%,3.0%,3.0%
1306,492045,01/02/2024,21:30,united states,USD,medium,Fed's Balance Sheet,"7,630B",,"7,677B"
1307,491895,02/02/2024,00:30,australia,AUD,medium,Home Loans (MoM),-5.6%,,0.3%
1308,490986,02/02/2024,00:30,australia,AUD,medium,PPI (QoQ)  (Q4),0.9%,1.9%,1.8%
1309,490985,02/02/2024,00:30,australia,AUD,medium,PPI (YoY)  (Q4),4.1%,,3.8%
1310,491897,02/02/2024,08:00,spain,EUR,medium,Spanish Unemployment Change,60.4K,-38.6K,-27.4K
1311,491020,02/02/2024,08:00,brazil,BRL,medium,IPC-Fipe Inflation Index (MoM)  (Jan),0.46%,,0.38%
1312,491034,02/02/2024,12:00,brazil,BRL,medium,Industrial Production (YoY)  (Dec),1.0%,0.1%,1.3%
1313,491046,02/02/2024,13:30,united states,USD,medium,Average Hourly Earnings (YoY) (YoY)  (Jan),4.5%,4.1%,4.3%
1314,491049,02/02/2024,13:30,united states,USD,high,Average Hourly Earnings (MoM)  (Jan),0.6%,0.3%,0.4%
1315,491044,02/02/2024,13:30,united states,USD,high,Nonfarm Payrolls  (Jan),353K,187K,333K
1316,491048,02/02/2024,13:30,united states,USD,medium,Participation Rate  (Jan),62.5%,62.6%,62.5%
1317,492548,02/02/2024,13:30,united states,USD,medium,"Payrolls Benchmark, n.s.a.",-187.00K,,-306.00K
1318,491043,02/02/2024,13:30,united states,USD,medium,Private Nonfarm Payrolls  (Jan),317K,155K,278K
1319,491051,02/02/2024,13:30,united states,USD,medium,U6 Unemployment Rate  (Jan),7.2%,,7.1%
1320,491045,02/02/2024,13:30,united states,USD,high,Unemployment Rate  (Jan),3.7%,3.8%,3.7%
1321,491061,02/02/2024,15:00,united states,USD,medium,Factory Orders (MoM)  (Dec),0.2%,0.3%,2.6%
1322,491057,02/02/2024,15:00,united states,USD,medium,Michigan 1-Year Inflation Expectations  (Jan),2.9%,2.9%,3.1%
1323,491058,02/02/2024,15:00,united states,USD,medium,Michigan 5-Year Inflation Expectations  (Jan),2.9%,2.8%,2.9%
1324,491059,02/02/2024,15:00,united states,USD,medium,Michigan Consumer Expectations  (Jan),77.1,75.9,67.4
1325,491056,02/02/2024,15:00,united states,USD,medium,Michigan Consumer Sentiment  (Jan),79.0,78.8,69.7
1326,491807,02/02/2024,18:00,united states,USD,medium,U.S. Baker Hughes Oil Rig Count,499,,499
1327,491808,02/02/2024,18:00,united states,USD,medium,U.S. Baker Hughes Total Rig Count,619,,621
1328,492119,02/02/2024,20:30,united kingdom,GBP,medium,CFTC GBP speculative net positions,34.2K,,31.4K
1329,492127,02/02/2024,20:30,united states,USD,medium,CFTC Crude Oil speculative net positions,196.7K,,184.0K
1330,492125,02/02/2024,20:30,united states,USD,medium,CFTC Gold speculative net positions,147.8K,,169.5K
1331,492117,02/02/2024,20:30,united states,USD,medium,CFTC Nasdaq 100 speculative net positions,39.3K,,33.0K
1332,492115,02/02/2024,20:30,united states,USD,medium,CFTC S&P 500 speculative net positions,-226.0K,,-189.5K
1333,492112,02/02/2024,20:30,australia,AUD,medium,CFTC AUD speculative net positions,-58.3K,,-54.1K
1334,492118,02/02/2024,20:30,brazil,BRL,medium,CFTC BRL speculative net positions,18.3K,,23.8K
1335,492111,02/02/2024,20:30,japan,JPY,medium,CFTC JPY speculative net positions,-80.5K,,-70.6K
1336,492114,02/02/2024,20:30,russia,RUB,medium,CFTC RUB speculative positions,-3.9K,,-5.2K
1337,492122,02/02/2024,20:30,euro zone,EUR,medium,CFTC EUR speculative net positions,88.8K,,88.3K
1338,492229,05/02/2024,00:30,australia,AUD,medium,Trade Balance  (Dec),10.959B,10.510B,11.764B
1339,491120,05/02/2024,00:30,japan,JPY,medium,au Jibun Bank Japan Services PMI  (Jan),53.1,52.7,51.5
1340,491124,05/02/2024,01:45,china,CNY,medium,Caixin Services PMI  (Jan),52.7,53.0,52.9
1341,491134,05/02/2024,06:00,russia,RUB,medium,Russian S&P Global Services PMI  (Jan),55.8,,56.2
1342,491144,05/02/2024,07:00,germany,EUR,medium,German Trade Balance  (Dec),22.2B,19.0B,20.7B
1343,491140,05/02/2024,07:00,türkiye,TRY,medium,CPI (YoY)  (Jan),64.86%,64.52%,64.77%
1344,491139,05/02/2024,07:00,türkiye,TRY,medium,CPI (MoM)  (Jan),6.70%,6.49%,2.93%
1345,491149,05/02/2024,08:15,spain,EUR,medium,HCOB Spain Services PMI  (Jan),52.1,52.2,51.5
1346,491153,05/02/2024,08:45,italy,EUR,medium,HCOB Italy Services PMI  (Jan),51.2,50.7,49.8
1347,491155,05/02/2024,08:50,france,EUR,medium,HCOB France Services PMI  (Jan),45.4,45.0,45.7
1348,491157,05/02/2024,08:55,germany,EUR,medium,HCOB Germany Services PMI  (Jan),47.7,47.6,49.3
1349,491159,05/02/2024,09:00,euro zone,EUR,medium,HCOB Eurozone Composite PMI  (Jan),47.9,47.9,47.6
1350,491158,05/02/2024,09:00,euro zone,EUR,medium,HCOB Eurozone Services PMI  (Jan),48.4,48.4,48.8
1351,491161,05/02/2024,09:30,united kingdom,GBP,medium,S&P Global/CIPS UK Composite PMI  (Jan),52.9,52.5,52.1
1352,491163,05/02/2024,09:30,united kingdom,GBP,medium,S&P Global/CIPS UK Services PMI  (Jan),54.3,53.8,53.4
1353,491186,05/02/2024,14:45,united states,USD,medium,S&P Global Composite PMI  (Jan),52.0,52.3,50.9
1354,491187,05/02/2024,14:45,united states,USD,high,S&P Global Services PMI  (Jan),52.5,52.9,51.4
1355,491189,05/02/2024,15:00,united states,USD,medium,ISM Non-Manufacturing Employment  (Jan),50.5,49.4,43.8
1356,491190,05/02/2024,15:00,united states,USD,high,ISM Non-Manufacturing PMI  (Jan),53.4,52.0,50.5
1357,491191,05/02/2024,15:00,united states,USD,high,ISM Non-Manufacturing Prices  (Jan),64.0,56.5,57.4
1358,491195,05/02/2024,23:30,japan,JPY,medium,Household Spending (MoM)  (Dec),-0.9%,0.2%,-1.0%
1359,491194,05/02/2024,23:30,japan,JPY,medium,Household Spending (YoY)  (Dec),-2.5%,-2.0%,-2.9%
1360,491199,06/02/2024,00:01,united kingdom,GBP,medium,BRC Retail Sales Monitor (YoY)  (Jan),1.4%,1.2%,1.9%
1361,492253,06/02/2024,00:30,australia,AUD,medium,Retail Sales (MoM)  (Dec),-2.7%,0.1%,1.6%
1362,488857,06/02/2024,03:30,australia,AUD,high,RBA Interest Rate Decision  (Feb),4.35%,4.35%,4.35%
1363,491212,06/02/2024,07:00,germany,EUR,medium,German Factory Orders (MoM)  (Dec),8.9%,-0.1%,0.0%
1364,491228,06/02/2024,09:30,united kingdom,GBP,medium,S&P Global / CIPS UK Construction PMI  (Jan),48.8,47.2,46.8
1365,491241,06/02/2024,13:30,canada,CAD,medium,Building Permits (MoM)  (Dec),-14.0%,1.8%,-5.0%
1366,491242,06/02/2024,15:00,canada,CAD,medium,Ivey PMI  (Jan),56.5,55.0,56.3
1367,492262,06/02/2024,18:00,united states,USD,medium,3-Year Note Auction,4.169%,,4.105%
1368,492263,06/02/2024,21:30,united states,USD,medium,API Weekly Crude Oil Stock,0.674M,2.133M,-2.500M
1369,491332,07/02/2024,07:00,united kingdom,GBP,medium,Halifax House Price Index (YoY)  (Jan),2.5%,,1.8%
1370,491333,07/02/2024,07:00,united kingdom,GBP,medium,Halifax House Price Index (MoM)  (Jan),1.3%,0.8%,1.1%
1371,491334,07/02/2024,07:00,germany,EUR,medium,German Industrial Production (MoM)  (Dec),-1.6%,-0.4%,-0.2%
1372,492273,07/02/2024,07:00,thailand,THB,medium,Interest Rate Decision,2.50%,2.50%,2.50%
1373,492280,07/02/2024,09:30,united kingdom,GBP,medium,Mortgage Rate (GBP)  (Jan),7.96%,,7.96%
1374,491705,07/02/2024,11:30,brazil,BRL,medium,Gross Debt-to-GDP ratio (MoM)  (Dec),74.3%,75.0%,73.8%
1375,491500,07/02/2024,12:00,brazil,BRL,medium,Retail Sales (MoM)  (Dec),-1.3%,-0.2%,0.1%
